[
  {
    "guid": "test_events:20001:delta:0",
    "startTime": "2026-09-14T12:15:00",
    "endTime": "2026-09-14T13:15:00",
    "urlRef": "https://example.org/orfe-upcoming-test/ada-lovelace-example-university",
    "location": {
      "name": "Sherrerd Hall",
      "id": "",
      "detail": "101"
    },
    "speaker": "Ada Lovelace\\, Example University",
    "content": "Abstract: This static test fixture mirrors the structure of a typical ORFE seminar record served by the upcoming feed. It exists only for downstream ingest validation while the live production feed is sparse or empty.",
    "series": "S. S. Wilks Memorial Seminar in Statistics",
    "title": "",
    "cancelled": "",
    "bannerImage": "",
    "itemType": "advertisement"
  },
  {
    "guid": "test_events:20002:delta:0",
    "startTime": "2026-09-17T16:30:00",
    "endTime": "2026-09-17T17:30:00",
    "urlRef": "https://example.org/orfe-upcoming-test/grace-hopper-sample-labs",
    "location": {
      "name": "Sherrerd Hall",
      "id": "",
      "detail": "101"
    },
    "speaker": "Grace Hopper\\, Sample Labs",
    "content": "Abstract: This record uses the same top-level keys, nested location object, and general text density as the production feed so consumers can exercise parsing, indexing, and display behavior against realistic JSON.",
    "series": "Optimization Seminar",
    "title": "",
    "cancelled": "",
    "bannerImage": "",
    "itemType": "advertisement"
  },
  {
    "guid": "test_events:20003:delta:0",
    "startTime": "2026-09-22T16:30:00",
    "endTime": "2026-09-22T17:30:00",
    "urlRef": "https://example.org/orfe-upcoming-test/katherine-johnson-demo-institute",
    "location": {
      "name": "Sherrerd Hall",
      "id": "",
      "detail": "101"
    },
    "speaker": "Katherine Johnson\\, Demo Institute",
    "series": "Optimization Seminar,ORFE Department Colloquia",
    "title": "",
    "cancelled": "",
    "bannerImage": "",
    "itemType": "advertisement"
  },
  {
    "guid": "test_events:20004:delta:0",
    "startTime": "2026-10-06T16:30:00",
    "endTime": "2026-10-06T17:30:00",
    "urlRef": "https://example.org/orfe-upcoming-test/claude-shannon-mock-research-center",
    "location": {
      "name": "Sherrerd Hall",
      "id": "",
      "detail": "101"
    },
    "speaker": "Claude Shannon\\, Mock Research Center",
    "content": "Abstract: Integration-test fixtures should look realistic without depending on current departmental schedules. This sample preserves expected field names, date formatting, and seminar metadata while remaining safe to reuse in automated tests.",
    "series": "ORFE Department Colloquia",
    "title": "",
    "cancelled": "",
    "bannerImage": "",
    "itemType": "advertisement"
  }
]
